{
  "id": "case-08",
  "title": "주식 알림 현황판, 알림을 2차로 미룸",
  "note": "case-03에서 알림 칸을 2차로 미루면 1차 난이도·준비물·진행 순서에서 텔레그램이 빠진다.",
  "answers": {
    "q.type": "board",
    "q.audience": "me",
    "q.ai": "agent",
    "q.save": "no",
    "q.domain": "finance",
    "q.finance-topic": "stock",
    "q.notify": "yes",
    "q.realtime": "realtime",
    "q.budget": "free-only",
    "q.device": "phone",
    "q.style": "bold"
  },
  "cart": ["react-vite", "fsc-stock", "telegram-bot", "cloudflare-workers"],
  "kept": ["conflict.realtime-mismatch"],
  "deferred": ["slot.notify"],
  "expect": {
    "asked": [
      "q.type",
      "q.audience",
      "q.ai",
      "q.save",
      "q.domain",
      "q.finance-topic",
      "q.notify",
      "q.realtime",
      "q.budget",
      "q.device",
      "q.style"
    ],
    "slots": [
      {
        "id": "slot.screen",
        "required": true,
        "recommended": "react-vite",
        "filledBy": ["react-vite"],
        "score": 4,
        "runnerUp": "html-single",
        "reasons": ["aiTool", "budget"]
      },
      {
        "id": "slot.data",
        "required": true,
        "recommended": "kis-open-api",
        "filledBy": ["fsc-stock"],
        "score": 6,
        "runnerUp": "fsc-stock",
        "reasons": ["domain", "topic", "budget"]
      },
      {
        "id": "slot.notify",
        "required": true,
        "recommended": "discord-webhook",
        "filledBy": ["telegram-bot"],
        "score": 4,
        "runnerUp": "slack-webhook",
        "reasons": ["aiTool", "budget", "official"]
      },
      {
        "id": "slot.host",
        "required": false,
        "recommended": "cloudflare-workers",
        "filledBy": ["cloudflare-workers"],
        "score": 7,
        "runnerUp": "netlify",
        "reasons": ["aiTool", "budget", "proxy"]
      }
    ],
    "conflicts": ["conflict.realtime-mismatch"],
    "canIssue": true,
    "research": ["research.realtime-source"],
    "safety": ["safety.proxy-key", "safety.finance-words"],
    "study": {
      "required": ["api", "api-key", "env-var"],
      "all": ["api", "json", "api-key", "env-var", "terminal", "deploy"]
    },
    "steps": ["slot.screen", "step.proxy", "slot.data", "slot.host"],
    "prep": ["공공데이터포털 가입 후 API 활용 신청 (승인 뒤 키가 동작하기까지 1~2시간)", "Node.js LTS 설치", "Cloudflare 가입"],
    "difficulty": 8,
    "difficultyFirst": 6,
    "minutes": 160,
    "split": { "needed": false, "defer": [], "easier": [] }
  }
}
