{
  "id": "case-12",
  "title": "버스 도착 알림 (공공데이터포털, 앱스 스크립트 예약 실행)",
  "note": "실시간 교통 상품이 진열대에 없어 추천이 없다. 포털 상품을 담고 실시간 충돌을 그대로 둔다.",
  "answers": {
    "q.type": "board",
    "q.audience": "me",
    "q.ai": "chat-free",
    "q.save": "no",
    "q.domain": "transport",
    "q.notify": "yes",
    "q.realtime": "realtime",
    "q.budget": "free-only",
    "q.device": "phone",
    "q.style": "clean"
  },
  "cart": ["html-single", "data-go-kr", "discord-webhook", "google-sheets-apps-script"],
  "kept": ["conflict.realtime-mismatch"],
  "expect": {
    "asked": [
      "q.type",
      "q.audience",
      "q.ai",
      "q.save",
      "q.domain",
      "q.notify",
      "q.realtime",
      "q.budget",
      "q.device",
      "q.style"
    ],
    "slots": [
      {
        "id": "slot.screen",
        "required": true,
        "recommended": "html-single",
        "filledBy": ["html-single"],
        "score": 4,
        "runnerUp": "react-vite",
        "reasons": ["aiTool", "budget"]
      },
      { "id": "slot.data", "required": true, "recommended": null, "filledBy": ["data-go-kr"] },
      {
        "id": "slot.notify",
        "required": true,
        "recommended": "discord-webhook",
        "filledBy": ["discord-webhook"],
        "score": 5,
        "runnerUp": "telegram-bot",
        "reasons": ["aiTool", "budget", "official"]
      },
      {
        "id": "slot.host",
        "required": false,
        "recommended": "google-sheets-apps-script",
        "filledBy": ["google-sheets-apps-script"],
        "score": 6,
        "runnerUp": "cloudflare-workers",
        "reasons": ["aiTool", "budget", "proxy"]
      }
    ],
    "conflicts": ["conflict.realtime-mismatch"],
    "canIssue": true,
    "research": ["research.pick-public-api", "research.schedule-run", "research.realtime-source"],
    "safety": ["safety.proxy-key"],
    "study": { "required": ["api", "api-key", "env-var"], "all": ["api", "json", "api-key", "env-var", "deploy"] },
    "steps": ["slot.screen", "step.proxy", "slot.data", "slot.notify", "slot.host"],
    "prep": ["공공데이터포털 가입 후 API 활용 신청 (승인 뒤 키가 동작하기까지 1~2시간)", "디스코드 서버의 채널 설정에서 웹후크 만들기", "구글 계정"],
    "difficulty": 6,
    "difficultyFirst": 6,
    "minutes": 160,
    "split": { "needed": false, "defer": [], "easier": [] }
  }
}
