{
  "id": "case-13",
  "title": "우리 반 퀴즈 (저작권 조사)",
  "note": "레시피 class-quiz와 같은 답. 여러 사람이 푸는 퀴즈라 저작권 조사 카드가 붙는다.",
  "answers": {
    "q.type": "quiz",
    "q.audience": "few",
    "q.ai": "chat-free",
    "q.save": "no",
    "q.domain": "none",
    "q.budget": "free-only",
    "q.payment": "no",
    "q.device": "phone",
    "q.style": "cute"
  },
  "cart": ["html-single", "github-pages"],
  "expect": {
    "asked": ["q.type", "q.audience", "q.ai", "q.save", "q.domain", "q.budget", "q.payment", "q.device", "q.style"],
    "slots": [
      {
        "id": "slot.screen",
        "required": true,
        "recommended": "html-single",
        "filledBy": ["html-single"],
        "score": 4,
        "runnerUp": "react-vite",
        "reasons": ["aiTool", "budget"]
      },
      {
        "id": "slot.host",
        "required": true,
        "recommended": "github-pages",
        "filledBy": ["github-pages"],
        "score": 4,
        "runnerUp": "google-sheets-apps-script",
        "reasons": ["aiTool", "budget", "official"]
      }
    ],
    "conflicts": [],
    "canIssue": true,
    "research": ["research.copyright"],
    "safety": [],
    "study": { "required": ["deploy"], "all": ["deploy", "git-repo"] },
    "steps": ["slot.screen", "slot.host"],
    "prep": ["GitHub 가입"],
    "difficulty": 3,
    "difficultyFirst": 3,
    "minutes": 80,
    "split": { "needed": false, "defer": [], "easier": [] }
  }
}
