{
  "id": "case-09",
  "title": "급식 안내 페이지를 GitHub Pages로 (키 노출 충돌)",
  "note": "중간 서버가 없어 키가 드러나는 충돌이 남아 발행할 수 없다.",
  "answers": {
    "q.type": "page",
    "q.audience": "anyone",
    "q.ai": "chat-free",
    "q.save": "no",
    "q.domain": "education",
    "q.edu-topic": "meal",
    "q.realtime": "daily",
    "q.budget": "free-only",
    "q.payment": "no",
    "q.device": "phone",
    "q.style": "cute"
  },
  "cart": ["html-single", "neis-meal", "github-pages"],
  "expect": {
    "asked": [
      "q.type",
      "q.audience",
      "q.ai",
      "q.save",
      "q.domain",
      "q.edu-topic",
      "q.realtime",
      "q.budget",
      "q.payment",
      "q.device",
      "q.style"
    ],
    "slots": [
      {
        "id": "slot.screen",
        "required": true,
        "recommended": "html-single",
        "filledBy": ["html-single"],
        "score": 4,
        "runnerUp": "react-vite",
        "reasons": ["aiTool", "budget"]
      },
      {
        "id": "slot.data",
        "required": true,
        "recommended": "neis-meal",
        "filledBy": ["neis-meal"],
        "score": 7,
        "runnerUp": "neis-schedule",
        "reasons": ["domain", "topic", "budget"]
      },
      {
        "id": "slot.host",
        "required": true,
        "recommended": "google-sheets-apps-script",
        "filledBy": ["github-pages"],
        "score": 6,
        "runnerUp": "cloudflare-workers",
        "reasons": ["aiTool", "budget", "proxy"]
      }
    ],
    "conflicts": ["conflict.key-in-static-page"],
    "canIssue": false,
    "research": [],
    "safety": [],
    "study": {
      "required": ["api", "api-key", "env-var"],
      "all": ["api", "json", "api-key", "env-var", "deploy", "git-repo"]
    },
    "steps": ["slot.screen", "slot.data", "slot.host"],
    "prep": ["교육정보 개방 포털에 로그인해 인증키 발급", "GitHub 가입"],
    "difficulty": 5,
    "difficultyFirst": 5,
    "minutes": 120,
    "split": { "needed": false, "defer": [], "easier": [] }
  }
}
